[
    {
        "schema": {
            "name": "updatestatus",
            "version": "1.1.3"
        },
        "brand": "vw",
        "market": "eu",
        "uuid": "4dabbbc2-fcb2-4074-a91c-5e2977a5bbf8",
        "sender": {
            "id": {
                "type": "CUSTOM",
                "val": "WCDP_ORUEN"
            },
            "dtime": "2024-03-20T13:10:08.3722639Z"
        },
        "origin": {
            "source": "backend",
            "dtime": "2024-03-20T14:37:15.0939400Z"
        },
        "vehicle": {
            "id": {
                "type": "vin",
                "val": "BVWCVWAUZ22053101"
            }
        },
        "updateEcosys": {
            "id": {
                "val": "e3-1.1-oru4"
            },
            "uc": {
                "id": {
                    "type": "custom",
                    "val": "upgrade"
                },
                "exec": {
                    "id": {
                        "val": "0"
                    }
                },
                "campaign": {
                    "id": {
                        "val": "RECALL_OUG6_A3_10001164_485DDF5413A04C2DAA40EF6892982D7F"
                    },
                    "recall": {
                        "action": {
                            "id": {
                                "val": "OUG6"
                            },
                            "criterion": {
                                "id": {
                                    "val": "A3"
                                }
                            }
                        }
                    },
                    "svc42ChangeMeasure": {
                        "id": {
                            "val": "003"
                        }
                    },
                    "batch": {
                        "id": {
                            "val": "485DDF5413A04C2DAA40EF6892982D7F"
                        }
                    }
                },
                "vehicleEvent": {
                    "key": "created",
                    "raw": "VEHICLE_ASSIGNED_TO_CAMPAIGN",
                    "message": {
                        "text": "A vehicle is now eligible for an update"
                    }
                }
            },
            "release": {
                "id": {
                    "val": "85H110100A"
                },
                "version": {
                    "val": "1015"
                },
                "notes": {
                    "id": {
                        "val": "rn-2023-09-06-test"
                    }
                }
            }
        }
    },
	{
        "schema": {
            "name": "updatestatus",
            "version": "1.1.3"
        },
        "brand": "vw",
        "market": "eu",
        "uuid": "078ec231-88bc-4d74-9774-96c0b820ceda",
        "sender": {
            "id": {
                "type": "CUSTOM",
                "val": "WCDP_ORUEN"
            },
            "dtime": "2024-03-20T13:10:08.3722639Z"
        },
        "origin": {
            "source": "backend",
            "dtime": "2024-03-20T14:37:15.0939400Z"
        },
        "vehicle": {
            "id": {
                "type": "vin",
                "val": "BVWCVWAUZ22053101"
            }
        },
        "updateEcosys": {
            "id": {
                "val": "e3-1.1-oru4"
            },
            "uc": {
                "id": {
                    "type": "custom",
                    "val": "upgrade"
                },
                "exec": {
                    "id": {
                        "val": "0"
                    }
                },
                "campaign": {
                    "id": {
                        "val": "RECALL_OUG6_A3_10001164_485DDF5413A04C2DAA40EF6892982D7F"
                    },
                    "recall": {
                        "action": {
                            "id": {
                                "val": "OUG6"
                            },
                            "criterion": {
                                "id": {
                                    "val": "A3"
                                }
                            }
                        }
                    },
                    "svc42ChangeMeasure": {
                        "id": {
                            "val": "003"
                        }
                    },
                    "batch": {
                        "id": {
                            "val": "485DDF5413A04C2DAA40EF6892982D7F"
                        }
                    }
                },
                "vehicleEvent": {
                    "key": "offboardPrepped",
                    "raw": "DD_SENT",
                    "message": {
                        "text": "Preparation on backend side are finished"
                    }
                }
            },
            "release": {
                "id": {
                    "val": "85H110100A"
                },
                "version": {
                    "val": "1015"
                },
                "notes": {
                    "id": {
                        "val": "rn-2023-09-06-test"
                    }
                }
            }
        }
    },
	{
        "schema": {
            "name": "updatestatus",
            "version": "1.1.3"
        },
        "brand": "vw",
        "market": "eu",
        "uuid": "726638fa-69a6-4a18-b09f-5fd2a708059b",
        "sender": {
            "id": {
                "type": "CUSTOM",
                "val": "WCDP_ORUEN"
            },
            "dtime": "2024-03-20T13:10:08.3722639Z"
        },
        "origin": {
            "source": "backend",
            "dtime": "2024-03-20T14:37:15.0939400Z"
        },
        "vehicle": {
            "id": {
                "type": "vin",
                "val": "BVWCVWAUZ22053101"
            }
        },
        "updateEcosys": {
            "id": {
                "val": "e3-1.1-oru4"
            },
            "uc": {
                "id": {
                    "type": "custom",
                    "val": "upgrade"
                },
                "exec": {
                    "id": {
                        "val": "0"
                    }
                },
                "campaign": {
                    "id": {
                        "val": "RECALL_OUG6_A3_10001164_485DDF5413A04C2DAA40EF6892982D7F"
                    },
                    "recall": {
                        "action": {
                            "id": {
                                "val": "OUG6"
                            },
                            "criterion": {
                                "id": {
                                    "val": "A3"
                                }
                            }
                        }
                    },
                    "svc42ChangeMeasure": {
                        "id": {
                            "val": "003"
                        }
                    },
                    "batch": {
                        "id": {
                            "val": "485DDF5413A04C2DAA40EF6892982D7F"
                        }
                    }
                },
                "vehicleEvent": {
                    "key": "onboardPrepped",
                    "raw": "DL_SESSION_COMPLETED",
                    "message": {
                        "text": "the vehicle software was updated"
                    }
                }
            },
            "release": {
                "id": {
                    "val": "85H110100A"
                },
                "version": {
                    "val": "1015"
                },
                "notes": {
                    "id": {
                        "val": "rn-2023-09-06-test"
                    }
                }
            }
        }
    },
	{
        "schema": {
            "name": "updatestatus",
            "version": "1.1.3"
        },
        "brand": "vw",
        "market": "eu",
        "uuid": "15616ebe-1dfd-4f5c-b2ed-cea0ac1ad823",
        "sender": {
            "id": {
                "type": "CUSTOM",
                "val": "WCDP_ORUEN"
            },
            "dtime": "2024-03-20T13:10:08.3722639Z"
        },
        "origin": {
            "source": "backend",
            "dtime": "2024-03-20T14:37:15.0939400Z"
        },
        "vehicle": {
            "id": {
                "type": "vin",
                "val": "BVWCVWAUZ22053101"
            }
        },
        "updateEcosys": {
            "id": {
                "val": "e3-1.1-oru4"
            },
            "uc": {
                "id": {
                    "type": "custom",
                    "val": "upgrade"
                },
                "exec": {
                    "id": {
                        "val": "0"
                    }
                },
                "campaign": {
                    "id": {
                        "val": "RECALL_OUG6_A3_10001164_485DDF5413A04C2DAA40EF6892982D7F"
                    },
                    "recall": {
                        "action": {
                            "id": {
                                "val": "OUG6"
                            },
                            "criterion": {
                                "id": {
                                    "val": "A3"
                                }
                            }
                        }
                    },
                    "svc42ChangeMeasure": {
                        "id": {
                            "val": "003"
                        }
                    },
                    "batch": {
                        "id": {
                            "val": "485DDF5413A04C2DAA40EF6892982D7F"
                        }
                    }
                },
                "vehicleEvent": {
                    "key": "updated",
                    "raw": "INSTALLATION_COMPLETE_DP",